{"schema":"ling.semantic-transaction/0.1","base_program_id":"experimental:blake3:0000000000000000000000000000000000000000000000000000000000000000","target_ids":["experimental:blake3:1111111111111111111111111111111111111111111111111111111111111111"],"operation":{"kind":"replace_source","content":"module Main\n\nlet value = 2\n"},"preserve":["definition_set","types","effects","capabilities"],"provenance":{"actor":"fixture","reason":"authorized body update"}}
